{
  "$schema": "https://json-schema.org/draft/2020-12/schema",
  "$id": "https://gpxplore.example/schema/camp-record.schema.json",
  "title": "CampRecord (compact, app-facing runtime shape)",
  "description": "The short-key record shape shipped to the browser and consumed by packages/route-components/src/lib/campgroundShared.ts in gpx-route-planner. This is the OUTPUT of the 'compact' pipeline stage — do not change key names without updating that package and its consumers (federalCampgrounds.ts, RouteMapView).",
  "type": "object",
  "required": ["i", "n", "t", "y", "x", "r", "f"],
  "properties": {
    "i": { "type": "string", "description": "Stable id, unique within an agency file (site_id / object_id / osm-<type>-<id>)." },
    "n": { "type": "string", "description": "Display name, title-cased if source was all-caps." },
    "t": {
      "type": "string",
      "enum": ["campground", "group", "dispersed", "horse", "developed", "other"],
      "description": "FacilityType — drives glyph + default layer grouping."
    },
    "y": { "type": "number", "minimum": -90, "maximum": 90, "description": "Latitude, rounded to 5 decimal places." },
    "x": { "type": "number", "minimum": -180, "maximum": 180, "description": "Longitude, rounded to 5 decimal places." },
    "r": { "type": ["string", "null"], "enum": ["res", "fcfs", "mixed", null], "description": "Collapsed reservation status — drives marker tier via tierFor()." },
    "rc": { "type": "string", "enum": ["def", "likely"], "description": "Confidence qualifier for r; omitted for reservable/mixed." },
    "f": { "type": ["integer", "null"], "enum": [0, 1, null], "description": "Fee charged: 1 yes, 0 no, null unknown." },
    "c": { "type": "integer", "description": "Total capacity, omitted if unknown." },
    "w": { "const": 1, "description": "Presence flag: drinking water available. Field omitted (not false) when not available." },
    "rt": { "const": 1, "description": "Presence flag: restroom available. Field omitted when not available." },
    "u": { "type": "string", "format": "uri", "description": "Detail/portal URL (fs.usda.gov, blm.gov, osm.org, ...)." },
    "el": { "type": "string", "description": "Elevation, free-text as sourced (e.g. '5,200 feet')." },
    "tn": { "type": "string", "description": "Closest town(s) or BLM unit name." },
    "d": { "type": "string", "description": "development_label passthrough, e.g. 'moderate'." },
    "st": { "type": "string", "description": "Two-letter state code (BLM records)." },
    "sub": { "type": "string", "description": "Raw subtype string for drawer display (BLM feature_subtype)." },
    "ds": { "type": "integer", "minimum": 0, "maximum": 5, "description": "development_scale passthrough." },
    "desc": { "type": "string", "maxLength": 1400, "description": "Truncated prose description." },
    "op": { "type": "string", "maxLength": 100, "description": "Operated-by line." },
    "fee_d": { "type": "string", "maxLength": 800, "description": "Multi-line fee schedule, whitespace-normalized but newlines preserved." },
    "ft": { "type": "string", "maxLength": 80, "description": "Fee type label." },
    "w_d": { "type": "string", "maxLength": 160, "description": "Water availability detail text." },
    "rt_d": { "type": "string", "maxLength": 160, "description": "Restroom availability detail text." },
    "dir": { "type": "string", "maxLength": 600, "description": "Driving directions." },
    "rest": { "type": "string", "maxLength": 400, "description": "Restrictions (e.g. stay limits)." },
    "cond": { "type": "string", "maxLength": 400, "description": "Current conditions text." },
    "sea": { "type": "string", "maxLength": 200, "description": "Open season text." },
    "hrs": { "type": "string", "maxLength": 200, "description": "Operational hours text." },
    "imp": { "type": "string", "maxLength": 400, "description": "Important info callout." },
    "ph": { "type": "string", "description": "Phone number (reserved for future OSM/other sources)." },
    "em": { "type": "string", "description": "Email address (reserved for future OSM/other sources)." }
  },
  "additionalProperties": false
}
